Duration,Job,Location,Updated
Full Time,Communications Director Office of City Council Member Ben Kallos,"New York, NY",1 week ago
Full Time,Brand Marketing/PR Account Executive AROS Communications,"New York, NY",1 week ago
Full Time,"Publications Coordinator, Communications Carnegie Endowment for International Peace","Washington, DC",1 week ago
Full Time,"Associate Digital Editor, Arts & Entertainment Boston Magazine","Boston, MA",1 week ago
Full Time,"Associate Digital Editor, Restaurants Boston Magazine","Boston, MA",1 week ago
Full Time,Deputy Digital Editor Boston Magazine,"Boston, MA",1 week ago
Full Time,Social Media Content Producer Columbia University Department of Surgery,"New York, NY",1 week ago
Full Time,Assistant Account Executive The Decker Royal Agency,"New York, NY",1 week ago
Full Time,"Production Assistant, Scripts & Manager, Desk Assistant PBS NewsHour (NewsHour Productions, LLC)","Washington, DC",1 week ago
Full Time,"Reporter Producer, Segment Unit PBS NewsHour (NewsHour Productions, LLC)","Washington, DC",1 week ago
Full Time,Sales Associate Kill Screen Media,"Brooklyn, NY",1 week ago
Full Time,"Editorial Assistant, POPSUGAR Latina POPSUGAR","New York, NY",1 week ago
Full Time,"Assistant Editor, POPSUGAR Living POPSUGAR","New York, NY",1 week ago
Full Time,"Senior Associate, Digital The Pew Charitable Trusts","Washington, DC",1 week ago
Full Time,Runner's World Midwest Sales Director Rodale,"Chicago, IL",1 week ago
Full Time,Social Media PR The Baddish Group,"New York, NY",1 week ago
Full Time,"Corporate Partnerships Director, CNMG Condé Nast",New York,1 week ago
Full Time,"Online Video Content Manager Outdoor Sportsman Group, Integrated Media","New York, NY",1 week ago
Full Time,Audience Development Associate The Baffler Foundation,"New York, NY",1 week ago
Full Time,Senior Art Director National Celebrity News Organization,"New York, NY",1 week ago
Full Time,Web Designer Palm Beach Research Group,"Baltimore, MD",1 week ago
Full Time,Senior Legal Editor - Criminal Law Bloomberg BNA,"Arlington, VA",1 week ago
Full Time,Senior Communications Specialist Columbia University - School of Nursing,"New York, NY",1 week ago
Internship,Fall Internship Lancome,"New York, NY",1 week ago
Full Time,HBO Social Media Research Analyst HBO,"New York, NY",1 week ago
Part Time,Marketing and Communications Assistant (Part Time) Prospect Park Alliance,"Brooklyn, NY",1 week ago
Full Time,Exhibits and Marketing Assistant Guilford Press,"New York, NY",1 week ago
Full Time,Media Negotiator Quad Graphics,"Greenville, SC",1 week ago
Full Time,Manuscript Editor Massachusetts Medical Society,"Boston, MA",1 week ago
Full Time,Senior Graphic Designer Schweitzer Engineering Laboratories,"Pullman, WA",1 week ago
Full Time,Marketing Manager BRIC,"Brooklyn, NY",1 week ago
Full Time,Social Media Strategist Verisk Analytics,"Jersey City, NJ",1 week ago
Full Time,Digital & Social Media Marketing Assistant BRIC,"Brooklyn, NY",1 week ago
Part Time,Freelance Associate Web Producer TWC Sports,"El Segundo, CA",1 week ago
Full Time,Digital Strategist/Product Owner Macmillan,"New York, NY",1 week ago
Full Time,Digital Marketing Specialist Fit Small Business,"New York, NY",1 week ago
Full Time,Advertising Operations Director SLAM/FlyQ Media,"New York, NY",1 week ago
Full Time,Producer - Upfront Al Jazeera English,"Washington, DC",1 week ago
Full Time,"Partner Manager, Facebook Acxiom","New York, NY",1 week ago
Full Time,Editor at Large New York Nonprofit Media,"New York, NY",1 week ago
Full Time,Production Coordinator National Celebrity News Organization,"New York, NY",1 week ago
Full Time,SEO Specialist Creative Circle,"Lawrenceville, GA",1 week ago
Full Time,Managing Editor Global Finance Magazine,"New York, NY",1 week ago
Full Time,Demand Generation Manager World Education Services,"New York, NY",1 week ago
Full Time,Managing Editor Taylor & Francis,"Philadelphia, PA",1 week ago
Internship,Digital Traffic Intern — Fall 2015 Mediaplanet,"New York, NY",1 week ago
Full Time,Senior Director West End Strategy Team,"Washington, DC",1 week ago
Full Time,"Sales & Marketing Manager International Awards Group, LLC.","New York, NY",1 week ago
Full Time,Senior Web Journalist DiversityInc,"Princeton, NJ",1 week ago
Full Time,"Direct Sales Manager Music Times, LLC","New York, NY",1 week ago
